{
  "$schema": "https://json-schema.org/draft/2020-12/schema",
  "$id": "https://kurultai.local/buildroom/schemas/verification-delta.schema.json",
  "title": "verification-delta",
  "type": "object",
  "required": [
    "delta_id",
    "build_id",
    "implementation_receipt_ref",
    "verification_report_ref",
    "state",
    "confirmed_claims",
    "unverified_claims",
    "regressions",
    "next_action"
  ],
  "additionalProperties": false,
  "properties": {
    "delta_id": {
      "type": "string"
    },
    "build_id": {
      "type": "string"
    },
    "implementation_receipt_ref": {
      "type": "string"
    },
    "verification_report_ref": {
      "type": "string"
    },
    "state": {
      "enum": [
        "confirmed",
        "drift",
        "regression",
        "missing_evidence"
      ]
    },
    "confirmed_claims": {
      "type": "array",
      "items": {
        "type": "string"
      }
    },
    "unverified_claims": {
      "type": "array",
      "items": {
        "type": "string"
      }
    },
    "regressions": {
      "type": "array",
      "items": {
        "type": "string"
      }
    },
    "next_action": {
      "type": "string"
    }
  }
}
