{
  "build_id": "build-buildroom-foundation-demo",
  "confirmed_claims": [
    "QA report passed"
  ],
  "delta_id": "delta-buildroom-foundation-demo",
  "implementation_receipt_ref": "jobs/implementation-receipt.json",
  "next_action": "Proceed to trust summary and retention review.",
  "regressions": [],
  "state": "confirmed",
  "unverified_claims": [],
  "verification_report_ref": "verification/verification-report.json"
}
